Title,Body,text,language,clean_text
I ordered shoes and sandals but it is…,"I ordered shoes and sandals but it is not showing as an order on Shein app. I paid on 1st March and can't contact Shein regarding this. How do you contact a person and not a robot.

The answer from Shein is not good enough. The email they asked me to contact is about 50 characters long. Why can't you just help me find the order I placed on 1st March and fully paid for?","I ordered shoes and sandals but it is… I ordered shoes and sandals but it is not showing as an order on Shein app. I paid on 1st March and can't contact Shein regarding this. How do you contact a person and not a robot.

The answer from Shein is not good enough. The email they asked me to contact is about 50 characters long. Why can't you just help me find the order I placed on 1st March and fully paid for?",en,ordered shoes sandals is… ordered shoes sandals showing order shein app paid 1st march cant contact shein regarding contact person robot answer shein good enough email asked contact 50 characters long cant help find order placed 1st march fully paid
🥰🥰🥰🥰🥰🥰🥰🥰🥰🥰🥰🥰,"Date of experience: March 03, 2025","🥰🥰🥰🥰🥰🥰🥰🥰🥰🥰🥰🥰 Date of experience: March 03, 2025",en,🥰🥰🥰🥰🥰🥰🥰🥰🥰🥰🥰🥰 date experience march 03 2025
Evri lost my parcel and SHEIN say it…,"Evri lost my parcel and SHEIN say it was delivered so won’t give me a refund or replacement, I used to like ordering from SHEIN but their customer service is awful you get an answer once a day with the same answer they gave you the day before.

As I dont have proof that it was stolen from outside my door (unless I was inside taking pictures I don’t know how I would have proof ) then I probably won’t get a refund or replacement-terrible service","Evri lost my parcel and SHEIN say it… Evri lost my parcel and SHEIN say it was delivered so won’t give me a refund or replacement, I used to like ordering from SHEIN but their customer service is awful you get an answer once a day with the same answer they gave you the day before.

As I dont have proof that it was stolen from outside my door (unless I was inside taking pictures I don’t know how I would have proof ) then I probably won’t get a refund or replacement-terrible service",en,evri lost parcel shein say it… evri lost parcel shein say delivered ’ give refund replacement used like ordering shein customer service awful get answer day answer gave day dont proof stolen outside door unless inside taking pictures ’ know would proof probably ’ get refund replacementterrible service
Good as usual,"Date of experience: February 14, 2025","Good as usual Date of experience: February 14, 2025",en,good usual date experience february 14 2025
This is one bad site...super hard to…,"This is one bad site...super hard to return...they make it very difficult to return an item
Will not purchase again..","This is one bad site...super hard to… This is one bad site...super hard to return...they make it very difficult to return an item
Will not purchase again..",en,one bad sitesuper hard to… one bad sitesuper hard returnthey make difficult return item purchase
DO NOT ORDER FROM SHEIN!,DO NOT ORDER FROM SHEIN!! THEY WORK WITH SCAM MECHANTS THAT DO NOT CARE WHAT THEY SEND YOU. SHEIN DOES NOT CARE IF THEY SCAM PEOPLE!! I KNOW THE PRICE IS CHEAP BUT YOU WILL BE UNHAPPY!!,DO NOT ORDER FROM SHEIN! DO NOT ORDER FROM SHEIN!! THEY WORK WITH SCAM MECHANTS THAT DO NOT CARE WHAT THEY SEND YOU. SHEIN DOES NOT CARE IF THEY SCAM PEOPLE!! I KNOW THE PRICE IS CHEAP BUT YOU WILL BE UNHAPPY!!,en,order shein order shein work scam mechants care send shein care scam people know price cheap unhappy
Unlike Amazon.....,"Unlike Amazon, most of the clothing I bought on Shein is true to size, decent quality, great prices and orders arrive in about 6-8 days. I love them! I have made several large orders through them and it's always been a great experience","Unlike Amazon..... Unlike Amazon, most of the clothing I bought on Shein is true to size, decent quality, great prices and orders arrive in about 6-8 days. I love them! I have made several large orders through them and it's always been a great experience",en,unlike amazon unlike amazon clothing bought shein true size decent quality great prices orders arrive 68 days love made several large orders always great experience
I bougth a article (tracking…,"I bougth a article (tracking No.771787465663), never was delivered to the correct address and SHEIN is not responsible for this.","I bougth a article (tracking… I bougth a article (tracking No.771787465663), never was delivered to the correct address and SHEIN is not responsible for this.",en,bougth article tracking… bougth article tracking no771787465663 never delivered correct address shein responsible
Shein slow,"I am in need of a reminder of what Shein is about. I look on Shein for some deals on drones, socks, and some types of hoodies. But every time I go on Shein, it takes like 2 minutes to load. This might be because of my old phone, but I think Shein could benefit from all this excess resource taking. I also almost always get women's recommendations the moment I open Shein, why not add a little variety to your landing? This seems pretty centered around one group. Yeah, that's all I have to say for this review, I ran out of words.

Thankies for reading,
DetectiveX","Shein slow I am in need of a reminder of what Shein is about. I look on Shein for some deals on drones, socks, and some types of hoodies. But every time I go on Shein, it takes like 2 minutes to load. This might be because of my old phone, but I think Shein could benefit from all this excess resource taking. I also almost always get women's recommendations the moment I open Shein, why not add a little variety to your landing? This seems pretty centered around one group. Yeah, that's all I have to say for this review, I ran out of words.

Thankies for reading,
DetectiveX",en,shein slow need reminder shein look shein deals drones socks types hoodies every time go shein takes like 2 minutes load might old phone think shein could benefit excess resource taking also almost always get womens recommendations moment open shein add little variety landing seems pretty centered around one group yeah thats say review ran words thankies reading detectivex
Very dissapointed,"I used to be a 5 but recently a 1. On Feb
23 I ordered a suit for my husband. It was giving me great tracking and said it would be here Saturday. I did not get it and the tracking info disappeared. I paid but got nothing. I put in 3 tickets with no response. I was a very valuable customer but if i dont get any response I am done with SHEIN","Very dissapointed I used to be a 5 but recently a 1. On Feb
23 I ordered a suit for my husband. It was giving me great tracking and said it would be here Saturday. I did not get it and the tracking info disappeared. I paid but got nothing. I put in 3 tickets with no response. I was a very valuable customer but if i dont get any response I am done with SHEIN",en,dissapointed used 5 recently 1 feb 23 ordered suit husband giving great tracking said would saturday get tracking info disappeared paid got nothing put 3 tickets response valuable customer dont get response done shein
Horrible customer service.,"Horrible customer service. I haven't received half of my order that was sent via SpeedX, an affiliate company of Shein. I have been going back and forth with them since later January about a package that was left outside of a huge building complex. This will my last time with them. They are horrible and keep send the same list of questions. Mind you I've answered these questions at least 7 times.","Horrible customer service. Horrible customer service. I haven't received half of my order that was sent via SpeedX, an affiliate company of Shein. I have been going back and forth with them since later January about a package that was left outside of a huge building complex. This will my last time with them. They are horrible and keep send the same list of questions. Mind you I've answered these questions at least 7 times.",en,horrible customer service horrible customer service havent received half order sent via speedx affiliate company shein going back forth since later january package left outside huge building complex last time horrible keep send list questions mind ive answered questions least 7 times
SHEIN has turned into such a scam…,SHEIN has turned into such a scam website!!! Watch the price of your items increase the more you buy!!! Then watch your total increase after you put the item in your cart and check out! talk about false advertising!!! What a joke.,SHEIN has turned into such a scam… SHEIN has turned into such a scam website!!! Watch the price of your items increase the more you buy!!! Then watch your total increase after you put the item in your cart and check out! talk about false advertising!!! What a joke.,en,shein turned scam… shein turned scam website watch price items increase buy watch total increase put item cart check talk false advertising joke
Servicio de reparto miserable ya que…,Servicio de reparto miserable ya que falsifican la firma del cliente y ustedes le dais la razón al transportista.,Servicio de reparto miserable ya que… Servicio de reparto miserable ya que falsifican la firma del cliente y ustedes le dais la razón al transportista.,en,servicio de reparto miserable ya que… servicio de reparto miserable ya que falsifican la firma del cliente ustedes le dais la razón al transportista
Worst Customer service ever,"I used to buy alot from shein until my last order that i did i got a lot of things couple of them I didn’t received and one of them which was a table and chairs after a week i found that they refunded my money when i asked the customer service they said that we don’t know what happened with the order but we gonna refund the item and i got over this
The other item I didn’t received it ,it was with $32 and the status on the application shipped and i was waiting for it too long until I texted the customer service they said that it is delivered i told them no its not because I didn’t find it and they said that they gonna investigate and get back to you after 3 days and as usual no one sent any email so I texted them through live chat after 5 days they said that they delivered it and if you didn’t receive it you can call UPS I told them I bought through shein not ups so you are in charge the customer service told me im sorry the package is delivered and unfortunately we can’t refund you
THEY ARE SO UNPROFESSIONAL AND I WONT BUY ANYTHING FROM SHEIN ITS A WASTE OF MONEY!!!","Worst Customer service ever I used to buy alot from shein until my last order that i did i got a lot of things couple of them I didn’t received and one of them which was a table and chairs after a week i found that they refunded my money when i asked the customer service they said that we don’t know what happened with the order but we gonna refund the item and i got over this
The other item I didn’t received it ,it was with $32 and the status on the application shipped and i was waiting for it too long until I texted the customer service they said that it is delivered i told them no its not because I didn’t find it and they said that they gonna investigate and get back to you after 3 days and as usual no one sent any email so I texted them through live chat after 5 days they said that they delivered it and if you didn’t receive it you can call UPS I told them I bought through shein not ups so you are in charge the customer service told me im sorry the package is delivered and unfortunately we can’t refund you
THEY ARE SO UNPROFESSIONAL AND I WONT BUY ANYTHING FROM SHEIN ITS A WASTE OF MONEY!!!",en,worst customer service ever used buy alot shein last order got lot things couple ’ received one table chairs week found refunded money asked customer service said ’ know happened order gon na refund item got item ’ received 32 status application shipped waiting long texted customer service said delivered told ’ find said gon na investigate get back 3 days usual one sent email texted live chat 5 days said delivered ’ receive call ups told bought shein ups charge customer service told im sorry package delivered unfortunately ’ refund unprofessional wont buy anything shein waste money
Lovely products. The products are what you ordered are…,"The products are what you ordered are what you get. Excellent shopping experience. I love to shop now, effortlessly","Lovely products. The products are what you ordered are… The products are what you ordered are what you get. Excellent shopping experience. I love to shop now, effortlessly",en,lovely products products ordered are… products ordered get excellent shopping experience love shop effortlessly
so i like shein and all but…,so i like shein and all but plssssssssssss add gift cards i am begging,so i like shein and all but… so i like shein and all but plssssssssssss add gift cards i am begging,en,like shein but… like shein plssssssssssss add gift cards begging
Very low quality products,Very low quality products and made compliant with international standards,Very low quality products Very low quality products and made compliant with international standards,en,low quality products low quality products made compliant international standards
12-25% deducted on the cost of returned items,I was happy with the delivery time and loved some of the items. However the returned item process was simple and quick but SHEIN deduct 12-25% of the cost of every item returned which I can’t find in their terms and conditions anywhere. Such a shame as I was about to place another order as loved some of the designs but the sizing was not right.,12-25% deducted on the cost of returned items I was happy with the delivery time and loved some of the items. However the returned item process was simple and quick but SHEIN deduct 12-25% of the cost of every item returned which I can’t find in their terms and conditions anywhere. Such a shame as I was about to place another order as loved some of the designs but the sizing was not right.,en,1225 deducted cost returned items happy delivery time loved items however returned item process simple quick shein deduct 1225 cost every item returned ’ find terms conditions anywhere shame place another order loved designs sizing right
Another great experience from shein!,"Date of experience: February 28, 2025","Another great experience from shein! Date of experience: February 28, 2025",en,another great experience shein date experience february 28 2025
"Used to love, not anymore…","I had always loved shopping with shein until recently.
Shein has now implemented a recoup fee if you part paid by wallet credit and points earned. I placed 3 orders. On my first order I did not use any credit yet when I returned the whole order, only £50 is being refunded when I paid £70.74. £20.74 is being kept as a recoup fee.

I understand the recoup fee on an order where I used points or wallet credit to pay. This wasn't the case however and I just feel it's wrong!","Used to love, not anymore… I had always loved shopping with shein until recently.
Shein has now implemented a recoup fee if you part paid by wallet credit and points earned. I placed 3 orders. On my first order I did not use any credit yet when I returned the whole order, only £50 is being refunded when I paid £70.74. £20.74 is being kept as a recoup fee.

I understand the recoup fee on an order where I used points or wallet credit to pay. This wasn't the case however and I just feel it's wrong!",en,used love anymore… always loved shopping shein recently shein implemented recoup fee part paid wallet credit points earned placed 3 orders first order use credit yet returned whole order £50 refunded paid £7074 £2074 kept recoup fee understand recoup fee order used points wallet credit pay wasnt case however feel wrong
Excellent site internet,Excellent site internet,Excellent site internet Excellent site internet,en,excellent site internet excellent site internet
Recomendable 100%,"Super rápido, en general todo genial la experiencia.","Recomendable 100% Super rápido, en general todo genial la experiencia.",en,recomendable 100 super rápido en general todo genial la experiencia
Articulos como se describen rapidez en…,Articulos como se describen rapidez en entrega y si algo no corresponde con talla o descripcion facil devolucion,Articulos como se describen rapidez en… Articulos como se describen rapidez en entrega y si algo no corresponde con talla o descripcion facil devolucion,en,articulos como se describen rapidez en… articulos como se describen rapidez en entrega si algo corresponde con talla descripcion facil devolucion
YOU HAVE TO PAY FOR SHIPPING ON RETURNS,"With the exception of one item, everything else in my order is too big. I attempted to return the items, but learned that I would be charged for a shipping fee for all items except for one. Had I known this, I would not have ordered from this company. The clothing items have a reputation of not being true to size and it is unpredictable whether or not they will fit properly. I will inform friends, family and my social media followers who might be considering ordering from Shien not to do so because if they have to return items, they will be responsible for paying for shipping on all items except for one. The items are typically not expensive, this being the case you will end up paying almost your entire refund in shipping cost.","YOU HAVE TO PAY FOR SHIPPING ON RETURNS With the exception of one item, everything else in my order is too big. I attempted to return the items, but learned that I would be charged for a shipping fee for all items except for one. Had I known this, I would not have ordered from this company. The clothing items have a reputation of not being true to size and it is unpredictable whether or not they will fit properly. I will inform friends, family and my social media followers who might be considering ordering from Shien not to do so because if they have to return items, they will be responsible for paying for shipping on all items except for one. The items are typically not expensive, this being the case you will end up paying almost your entire refund in shipping cost.",en,pay shipping returns exception one item everything else order big attempted return items learned would charged shipping fee items except one known would ordered company clothing items reputation true size unpredictable whether fit properly inform friends family social media followers might considering ordering shien return items responsible paying shipping items except one items typically expensive case end paying almost entire refund shipping cost
Terribili,Materiale scadente,Terribili Materiale scadente,en,terribili materiale scadente
very bad i don’t use copons and i play…,very bad i don’t use copons and i play puppy game its almost 1 month ufff very bad shein very bad,very bad i don’t use copons and i play… very bad i don’t use copons and i play puppy game its almost 1 month ufff very bad shein very bad,en,bad ’ use copons play… bad ’ use copons play puppy game almost 1 month ufff bad shein bad
Un vestito è errato all’interno del mio…,Un vestito è errato all’interno del mio ordine,Un vestito è errato all’interno del mio… Un vestito è errato all’interno del mio ordine,en,un vestito è errato ’ interno del mio… un vestito è errato ’ interno del mio ordine
Vêtements au top,Vêtements au top,Vêtements au top Vêtements au top,en,vêtements au top vêtements au top
Parfait parfait,Parfait parfait,Parfait parfait Parfait parfait,en,parfait parfait parfait parfait
Belle come in foto,"Date of experience: February 27, 2025","Belle come in foto Date of experience: February 27, 2025",en,belle come foto date experience february 27 2025
Poor Quality & Horrible Customer Service,"Update:
To get refund for damaged and defective items, you need to return them too.

Reach out to customer, find the original package with barcode, get UPS barcode for return.
Drop them off to UPS Store, waiting for refund.
Don’t feel like it’s worth to shop here any more, quite annoying how much wasted my time.
03/01/2025
————————————————
This website is legit BUT horrible customer service and poor quality.

Earring material description said titanium BUT it caused an allergic reaction which is not titanium.

I requested to return and here is the customer's response.

The 1st staff asked me to take a picture of my damaged skin. So I sent it.

The 2nd staff said ""For the skin damage, kindly come to the doctor to share with us a medical certificate so that we can help you better with that.""

Who is willing to go to see the Dermatology with Copay $25-$60 to get a $1.67 earring refund?

Truly ridiculous","Poor Quality & Horrible Customer Service Update:
To get refund for damaged and defective items, you need to return them too.

Reach out to customer, find the original package with barcode, get UPS barcode for return.
Drop them off to UPS Store, waiting for refund.
Don’t feel like it’s worth to shop here any more, quite annoying how much wasted my time.
03/01/2025
————————————————
This website is legit BUT horrible customer service and poor quality.

Earring material description said titanium BUT it caused an allergic reaction which is not titanium.

I requested to return and here is the customer's response.

The 1st staff asked me to take a picture of my damaged skin. So I sent it.

The 2nd staff said ""For the skin damage, kindly come to the doctor to share with us a medical certificate so that we can help you better with that.""

Who is willing to go to see the Dermatology with Copay $25-$60 to get a $1.67 earring refund?

Truly ridiculous",en,poor quality horrible customer service update get refund damaged defective items need return reach customer find original package barcode get ups barcode return drop ups store waiting refund ’ feel like ’ worth shop quite annoying much wasted time 03012025 ———————————————— website legit horrible customer service poor quality earring material description said titanium caused allergic reaction titanium requested return customers response 1st staff asked take picture damaged skin sent 2nd staff said skin damage kindly come doctor share us medical certificate help better willing go see dermatology copay 2560 get 167 earring refund truly ridiculous
