Title,Body,text,language,clean_text
One of the things I ordered didn't…,One of the things I ordered didn't arrive,One of the things I ordered didn't… One of the things I ordered didn't arrive,en,one things ordered didnt… one things ordered didnt arrive
SHEIN review,"I recently ordered a few items from SHEIN.
First, the prices are amazing—I snagged some super cute dresses for really low prices. However, the sizing was tricky. I ordered a size up based on reviews, but one dress was still too tight!
The quality was also hit or miss. Some pieces looked and felt great, while others were a bit flimsy. I had an issue with one item and tried to contact customer service, but they weren't very helpful.
Overall, SHEIN has some great finds if you're willing to take the risk. Just be sure to read reviews and double-check the sizing! Would I shop there again? Maybe, but I'll be more cautious next time!","SHEIN review I recently ordered a few items from SHEIN.
First, the prices are amazing—I snagged some super cute dresses for really low prices. However, the sizing was tricky. I ordered a size up based on reviews, but one dress was still too tight!
The quality was also hit or miss. Some pieces looked and felt great, while others were a bit flimsy. I had an issue with one item and tried to contact customer service, but they weren't very helpful.
Overall, SHEIN has some great finds if you're willing to take the risk. Just be sure to read reviews and double-check the sizing! Would I shop there again? Maybe, but I'll be more cautious next time!",en,shein review recently ordered items shein first prices amazing—i snagged super cute dresses really low prices however sizing tricky ordered size based reviews one dress still tight quality also hit miss pieces looked felt great others bit flimsy issue one item tried contact customer service werent helpful overall shein great finds youre willing take risk sure read reviews doublecheck sizing would shop maybe ill cautious next time
Great value for money,Great value for money. Sometimes shipping takes longer than expected or doesn't arrive at all to the Canary Islands but it's worth it when it does,Great value for money Great value for money. Sometimes shipping takes longer than expected or doesn't arrive at all to the Canary Islands but it's worth it when it does,en,great value money great value money sometimes shipping takes longer expected doesnt arrive canary islands worth
Good perfect,Good perfect,Good perfect Good perfect,en,good perfect good perfect
If you want to throw your money away,"If you want to throw your money away, go shopping or burn it in the fireplace to keep warm. A month ago, I made a purchase, and they delivered it to a completely different address. You can check on Google—the photos of the house they delivered to and my house are completely different. I submitted a form two weeks ago, but no one has responded.","If you want to throw your money away If you want to throw your money away, go shopping or burn it in the fireplace to keep warm. A month ago, I made a purchase, and they delivered it to a completely different address. You can check on Google—the photos of the house they delivered to and my house are completely different. I submitted a form two weeks ago, but no one has responded.",en,want throw money away want throw money away go shopping burn fireplace keep warm month ago made purchase delivered completely different address check google—the photos house delivered house completely different submitted form two weeks ago one responded
The items came fast and in good…,The items came fast and in good conditions.,The items came fast and in good… The items came fast and in good conditions.,en,items came fast good… items came fast good conditions
Cheap low-quality clothes,"Shipping - super fast and cheap
Product design - stylish, chic, trendy
Product quality - very poor. Thin fabric. Plastic-y feel of fabric. Colours don't look as good as pictures on the website.

My lesson learnt is not to buy clothes from Shein because I'd not want to wear it or wear it a couple of times and then send it to recycle. Unless I am a student or someone who wants to look low-budget. You get the gist.","Cheap low-quality clothes Shipping - super fast and cheap
Product design - stylish, chic, trendy
Product quality - very poor. Thin fabric. Plastic-y feel of fabric. Colours don't look as good as pictures on the website.

My lesson learnt is not to buy clothes from Shein because I'd not want to wear it or wear it a couple of times and then send it to recycle. Unless I am a student or someone who wants to look low-budget. You get the gist.",en,cheap lowquality clothes shipping super fast cheap product design stylish chic trendy product quality poor thin fabric plasticy feel fabric colours dont look good pictures website lesson learnt buy clothes shein id want wear wear couple times send recycle unless student someone wants look lowbudget get gist
It’s a hit or miss with SHEIN on the…,"It’s a hit or miss with SHEIN on the products which I understand at the low prices but the games they want you to play are just bait click impossible to win you can feed that puppy 50,000 worth good & not get a full point it slows completely down after you hit 99.0 just pathetic they really need to do better if they actually want people to participate!! And on top of that cheap price or not if I click on an item I want to buy why th would you send me something different from what I spent my hard earned money on","It’s a hit or miss with SHEIN on the… It’s a hit or miss with SHEIN on the products which I understand at the low prices but the games they want you to play are just bait click impossible to win you can feed that puppy 50,000 worth good & not get a full point it slows completely down after you hit 99.0 just pathetic they really need to do better if they actually want people to participate!! And on top of that cheap price or not if I click on an item I want to buy why th would you send me something different from what I spent my hard earned money on",en,’ hit miss shein the… ’ hit miss shein products understand low prices games want play bait click impossible win feed puppy 50000 worth good get full point slows completely hit 990 pathetic really need better actually want people participate top cheap price click item want buy th would send something different spent hard earned money
Very fast delivery,Very fast delivery. I am very satisfied,Very fast delivery Very fast delivery. I am very satisfied,en,fast delivery fast delivery satisfied
Not even worth the hassle,"The clothing came in later than date provided. The clothes ran extremely big for the sizes. I requested refunds and shipped back according to all the extra policies they make you follow , which is a huge hassle, and I still haven't received any refund. No money back as promised not even a store credit. Very unhappy as this has been months. Contacted customer service and they still couldn't provide me with any more information. Waste of time and money!","Not even worth the hassle The clothing came in later than date provided. The clothes ran extremely big for the sizes. I requested refunds and shipped back according to all the extra policies they make you follow , which is a huge hassle, and I still haven't received any refund. No money back as promised not even a store credit. Very unhappy as this has been months. Contacted customer service and they still couldn't provide me with any more information. Waste of time and money!",en,even worth hassle clothing came later date provided clothes ran extremely big sizes requested refunds shipped back according extra policies make follow huge hassle still havent received refund money back promised even store credit unhappy months contacted customer service still couldnt provide information waste time money
Falsche Erstattung,"Initially, with their discount (some coupons/punkts), the order cost was 62.56€. This criminal company Shein withdrew 70.46€ from my bank account.I returned 4 items(not 3) for a total of €32.21. They accepted only three items for return, and I sent actually 4 items! They were undamaged! But they returned me only 10.10€ Where is the other 30.01€? I had to pay 62.56€, but in fact I paid 7.90€ more. In addition, out of 32.21€ I only received 10.10€. So they stole my 30€. It's terrible! I wish I would never buy anything on Shein!","Falsche Erstattung Initially, with their discount (some coupons/punkts), the order cost was 62.56€. This criminal company Shein withdrew 70.46€ from my bank account.I returned 4 items(not 3) for a total of €32.21. They accepted only three items for return, and I sent actually 4 items! They were undamaged! But they returned me only 10.10€ Where is the other 30.01€? I had to pay 62.56€, but in fact I paid 7.90€ more. In addition, out of 32.21€ I only received 10.10€. So they stole my 30€. It's terrible! I wish I would never buy anything on Shein!",en,falsche erstattung initially discount couponspunkts order cost 6256€ criminal company shein withdrew 7046€ bank accounti returned 4 itemsnot 3 total €3221 accepted three items return sent actually 4 items undamaged returned 1010€ 3001€ pay 6256€ fact paid 790€ addition 3221€ received 1010€ stole 30€ terrible wish would never buy anything shein
Sent a parcel back got charged a…,Sent a parcel back got charged a handling fee of over £20 don’t get charged that for a pallet of tiles. DONE NOT SHOP ON THIS SITE ABSOLUTELY DISGUSTING- GOING TO GET THIS ADDRESSED WITH TRADING STANDARDS.,Sent a parcel back got charged a… Sent a parcel back got charged a handling fee of over £20 don’t get charged that for a pallet of tiles. DONE NOT SHOP ON THIS SITE ABSOLUTELY DISGUSTING- GOING TO GET THIS ADDRESSED WITH TRADING STANDARDS.,en,sent parcel back got charged a… sent parcel back got charged handling fee £20 ’ get charged pallet tiles done shop site absolutely disgusting going get addressed trading standards
Au top top top top top top,"Date of experience: January 09, 2025","Au top top top top top top Date of experience: January 09, 2025",en,au top top top top top top date experience january 09 2025
Buyer beware..,"After receiving an item that was clearly not what was pictured on their website. I sent them 3 photos of the item which was supposed to be a tufted cat pillow that was pictured with front to back faux fur and was also tufted. What I received was a flat piece of faux fur fabric, not even front to back, but on the backside, was rubber like a rug. It was flat, it was basically a rug, no tufting or anything. I found out it was a non returnable item. That is why I reached out to Shein, to get my money back. Sending them photos of what I received front to back and the answer I got back was there was no clear way to tell that this was not the same item that was in the photo!! I was totally shocked. After this, I will not be purchasing from them again. I proceeded to return my other items and my daughter did the same with hers. Before, I used to enjoy shopping from them. But now knowing that they do not stand behind their products, in fact, protect sellers and also may I say they removed my review from the itm warning others complete with removing my phots to show whatwill actuall arive underneath this item AND removed the item from my purchase list so I can't even see it anymore but did not return my money!! So basically, under my name where I can look at my purchases. This item has been removed, but yet they have kept my money! No I do not recommend this site to anyone! Buyer bewareIf it's too cheap to believe, don't believe it! Part of this review asks for your order number for the item. Unfortunately I can't look that up because sheen remove the item from my purchase list! I am going to try to find it another way. So hopefully I will be able to post this. Maybe I have it still in in email.If so I will add it to this and I will be able to actually post this review.
Update 2/3/25
In regards to Shein's response below I have already followed those steps. And as I stayed it, even when I sent them, photographs stated that they saw no difference between the tufted pillows that was shown on their website and the flat singe fabric mat that I was sent. So there is no need for me to contact their customer service. As this is what i've already done and received my answer from them.","Buyer beware.. After receiving an item that was clearly not what was pictured on their website. I sent them 3 photos of the item which was supposed to be a tufted cat pillow that was pictured with front to back faux fur and was also tufted. What I received was a flat piece of faux fur fabric, not even front to back, but on the backside, was rubber like a rug. It was flat, it was basically a rug, no tufting or anything. I found out it was a non returnable item. That is why I reached out to Shein, to get my money back. Sending them photos of what I received front to back and the answer I got back was there was no clear way to tell that this was not the same item that was in the photo!! I was totally shocked. After this, I will not be purchasing from them again. I proceeded to return my other items and my daughter did the same with hers. Before, I used to enjoy shopping from them. But now knowing that they do not stand behind their products, in fact, protect sellers and also may I say they removed my review from the itm warning others complete with removing my phots to show whatwill actuall arive underneath this item AND removed the item from my purchase list so I can't even see it anymore but did not return my money!! So basically, under my name where I can look at my purchases. This item has been removed, but yet they have kept my money! No I do not recommend this site to anyone! Buyer bewareIf it's too cheap to believe, don't believe it! Part of this review asks for your order number for the item. Unfortunately I can't look that up because sheen remove the item from my purchase list! I am going to try to find it another way. So hopefully I will be able to post this. Maybe I have it still in in email.If so I will add it to this and I will be able to actually post this review.
Update 2/3/25
In regards to Shein's response below I have already followed those steps. And as I stayed it, even when I sent them, photographs stated that they saw no difference between the tufted pillows that was shown on their website and the flat singe fabric mat that I was sent. So there is no need for me to contact their customer service. As this is what i've already done and received my answer from them.",en,buyer beware receiving item clearly pictured website sent 3 photos item supposed tufted cat pillow pictured front back faux fur also tufted received flat piece faux fur fabric even front back backside rubber like rug flat basically rug tufting anything found non returnable item reached shein get money back sending photos received front back answer got back clear way tell item photo totally shocked purchasing proceeded return items daughter used enjoy shopping knowing stand behind products fact protect sellers also may say removed review itm warning others complete removing phots show whatwill actuall arive underneath item removed item purchase list cant even see anymore return money basically name look purchases item removed yet kept money recommend site anyone buyer bewareif cheap believe dont believe part review asks order number item unfortunately cant look sheen remove item purchase list going try find another way hopefully able post maybe still emailif add able actually post review update 2325 regards sheins response already followed steps stayed even sent photographs stated saw difference tufted pillows shown website flat singe fabric mat sent need contact customer service ive already done received answer
Super bien merci,Super bien merci,Super bien merci Super bien merci,en,super bien merci super bien merci
Just ridiculous,"Just ridiculous. Placed an order 23rd January, it was in London by the 1st February and then I had an email to say I’d be refunded because the order has been returned by my local carrier. Royal Mail hadn’t even received the package at this point. Customer service have been no help whatsoever, and can’t give me a reason as to why my order has suddenly been sent back days after arriving in my country. Unhelpful, unprofessional, unacceptable.","Just ridiculous Just ridiculous. Placed an order 23rd January, it was in London by the 1st February and then I had an email to say I’d be refunded because the order has been returned by my local carrier. Royal Mail hadn’t even received the package at this point. Customer service have been no help whatsoever, and can’t give me a reason as to why my order has suddenly been sent back days after arriving in my country. Unhelpful, unprofessional, unacceptable.",en,ridiculous ridiculous placed order 23rd january london 1st february email say ’ refunded order returned local carrier royal mail ’ even received package point customer service help whatsoever ’ give reason order suddenly sent back days arriving country unhelpful unprofessional unacceptable
I was charged £40 on top of the order…,"I was charged £40 on top of the order despite having paid the £5 membership fee before making my order which was supposed to save me this extra ""handling charge"". Despite I having written to customer service regarding this matter they have not bothered to respond to me or refund me this unreasonable surcharge that they have taken from me.

Also, there was no clear invoice sent to me with the price of each of the goods and only pictures of the goods.

I have made 3 separate orders but only see one on my account. They didn't forget to take the money from my account though!

There is no clear instructions on how to return clothing which doesn't fit. And also I'm unclear if I am expected to pay to post them back to a UK address or a Chinese address or if returns are freepost?

Several items never have showed up.

Prospective buyer BEWARE!!!!!!!!!!!!!!!!!!!!!!!!","I was charged £40 on top of the order… I was charged £40 on top of the order despite having paid the £5 membership fee before making my order which was supposed to save me this extra ""handling charge"". Despite I having written to customer service regarding this matter they have not bothered to respond to me or refund me this unreasonable surcharge that they have taken from me.

Also, there was no clear invoice sent to me with the price of each of the goods and only pictures of the goods.

I have made 3 separate orders but only see one on my account. They didn't forget to take the money from my account though!

There is no clear instructions on how to return clothing which doesn't fit. And also I'm unclear if I am expected to pay to post them back to a UK address or a Chinese address or if returns are freepost?

Several items never have showed up.

Prospective buyer BEWARE!!!!!!!!!!!!!!!!!!!!!!!!",en,charged £40 top order… charged £40 top order despite paid £5 membership fee making order supposed save extra handling charge despite written customer service regarding matter bothered respond refund unreasonable surcharge taken also clear invoice sent price goods pictures goods made 3 separate orders see one account didnt forget take money account though clear instructions return clothing doesnt fit also im unclear expected pay post back uk address chinese address returns freepost several items never showed prospective buyer beware
No response from Shein for a return,I have tried to contact customer service for a return and they will not respond. I do not recommend ordering from this company.,No response from Shein for a return I have tried to contact customer service for a return and they will not respond. I do not recommend ordering from this company.,en,response shein return tried contact customer service return respond recommend ordering company
Terrible customer service experience,"I would strongly advise against shopping with Shein, although they do sell some affordable items. If you do choose to buy from them, be warned: should your parcel get mishandled, do not expect top-notch customer service. Shein's staff seem indifferent and unhelpful, providing nothing more than an automated response that your parcel has been delivered according to their system.

Despite providing proof from the delivery service that my parcels have been lost, Shein persists in referencing their system, which inaccurately shows the parcels as delivered. They consistently ignore my requests to escalate the issue or raise a formal complaint.

This has happened to me not once, but seven times in a row. I've lost hundreds of pounds worth of items, and each time, Shein has refused to take any action or provide any assistance. Though their prices are low, you might end up losing much more due to their unwillingness to help. Their service is truly terrible.","Terrible customer service experience I would strongly advise against shopping with Shein, although they do sell some affordable items. If you do choose to buy from them, be warned: should your parcel get mishandled, do not expect top-notch customer service. Shein's staff seem indifferent and unhelpful, providing nothing more than an automated response that your parcel has been delivered according to their system.

Despite providing proof from the delivery service that my parcels have been lost, Shein persists in referencing their system, which inaccurately shows the parcels as delivered. They consistently ignore my requests to escalate the issue or raise a formal complaint.

This has happened to me not once, but seven times in a row. I've lost hundreds of pounds worth of items, and each time, Shein has refused to take any action or provide any assistance. Though their prices are low, you might end up losing much more due to their unwillingness to help. Their service is truly terrible.",en,terrible customer service experience would strongly advise shopping shein although sell affordable items choose buy warned parcel get mishandled expect topnotch customer service sheins staff seem indifferent unhelpful providing nothing automated response parcel delivered according system despite providing proof delivery service parcels lost shein persists referencing system inaccurately shows parcels delivered consistently ignore requests escalate issue raise formal complaint happened seven times row ive lost hundreds pounds worth items time shein refused take action provide assistance though prices low might end losing much due unwillingness help service truly terrible
Worst company and customer service…,Worst company and customer service ever. Ordered a pretty big order that was delivered in 2 packages. First order came fine 2nd order came delivered with a tampered with package that you can tell was cut open and taped closed. Lots of items were missing. I contacted Shein and they kept advising to check package for missing items these items were clearly missing about 17 items missing. They said they would not refund either. Will never again order from this company.,Worst company and customer service… Worst company and customer service ever. Ordered a pretty big order that was delivered in 2 packages. First order came fine 2nd order came delivered with a tampered with package that you can tell was cut open and taped closed. Lots of items were missing. I contacted Shein and they kept advising to check package for missing items these items were clearly missing about 17 items missing. They said they would not refund either. Will never again order from this company.,en,worst company customer service… worst company customer service ever ordered pretty big order delivered 2 packages first order came fine 2nd order came delivered tampered package tell cut open taped closed lots items missing contacted shein kept advising check package missing items items clearly missing 17 items missing said would refund either never order company
I enjoy shopping with SHEIN,"I enjoy shopping with SHEIN. Lots to choose from, great prices and quick to receive. I enjoy their “check-in” for extra points. The app is very user friendly and tons and tons of great products!","I enjoy shopping with SHEIN I enjoy shopping with SHEIN. Lots to choose from, great prices and quick to receive. I enjoy their “check-in” for extra points. The app is very user friendly and tons and tons of great products!",en,enjoy shopping shein enjoy shopping shein lots choose great prices quick receive enjoy “ checkin ” extra points app user friendly tons tons great products
