Title,Body,text,language,clean_text
Missing Order,"My daughter placed an order on December 20, 2024, and as of January 14, 2025, it has not been delivered. Despite several attempts to contact a representative, I have not received any calls or emails regarding the missing order. Additionally, when I checked the prompts provided, it indicated that the order number does not exist.

I would appreciate guidance on how to speak with an actual person to address this matter. Unfortunately, my experience with Shein's customer service has been extremely disappointing. I will not be using this site again, and I strongly advise others to consider carefully where they choose to spend their money.","Missing Order My daughter placed an order on December 20, 2024, and as of January 14, 2025, it has not been delivered. Despite several attempts to contact a representative, I have not received any calls or emails regarding the missing order. Additionally, when I checked the prompts provided, it indicated that the order number does not exist.

I would appreciate guidance on how to speak with an actual person to address this matter. Unfortunately, my experience with Shein's customer service has been extremely disappointing. I will not be using this site again, and I strongly advise others to consider carefully where they choose to spend their money.",en,missing order daughter placed order december 20 2024 january 14 2025 delivered despite several attempts contact representative received calls emails regarding missing order additionally checked prompts provided indicated order number exist would appreciate guidance speak actual person address matter unfortunately experience sheins customer service extremely disappointing using site strongly advise others consider carefully choose spend money
Do not buy from this site,Do not buy from this site. I recently placed a large order which was scheduled to be delivered in two separate packages. The first came with no issue. The second was delivered to the completely wrong address. The carrier posted pictures of the package with my correct address and him placing it in a mailbox that did not match my address. It was blatantly wrong!!! I made several attempts to notify SHEIN even trying to connect via social media. The repeatedly said they would do nothing because the package was delivered. I ended asking them that because it was delivered to A ADDRESS despite being the wrong one that they wouldn’t do anything. They confirmed. No replacements items and no refund. SHEIN will rob you of your hard earned money. I will NEVER buy anything from them again,Do not buy from this site Do not buy from this site. I recently placed a large order which was scheduled to be delivered in two separate packages. The first came with no issue. The second was delivered to the completely wrong address. The carrier posted pictures of the package with my correct address and him placing it in a mailbox that did not match my address. It was blatantly wrong!!! I made several attempts to notify SHEIN even trying to connect via social media. The repeatedly said they would do nothing because the package was delivered. I ended asking them that because it was delivered to A ADDRESS despite being the wrong one that they wouldn’t do anything. They confirmed. No replacements items and no refund. SHEIN will rob you of your hard earned money. I will NEVER buy anything from them again,en,buy site buy site recently placed large order scheduled delivered two separate packages first came issue second delivered completely wrong address carrier posted pictures package correct address placing mailbox match address blatantly wrong made several attempts notify shein even trying connect via social media repeatedly said would nothing package delivered ended asking delivered address despite wrong one ’ anything confirmed replacements items refund shein rob hard earned money never buy anything
Missing Items and Poor Customer Support,"I recently placed an order (Order Number: GSH10529A000SNM) with [SHEIN], but unfortunately, my experience has been disappointing. The shipment was supposed to contain 48 items, but I only received 34 items, leaving 14 items missing.

I reached out to the support team multiple times via live chat and phone calls, but the issue remains unresolved. They claimed the shipment was sent in full. When I contacted the courier company, they confirmed that they delivered the shipment exactly as received from [SHEIN].

This has caused a lot of frustration, and I kindly ask the company to: investigate the issue thoroughly and identify the reason behind this significant shortage. I also request either:

The missing items to be resent to me.
A refund for the value of the missing items.
I look forward to your prompt response and resolution of this matter.","Missing Items and Poor Customer Support I recently placed an order (Order Number: GSH10529A000SNM) with [SHEIN], but unfortunately, my experience has been disappointing. The shipment was supposed to contain 48 items, but I only received 34 items, leaving 14 items missing.

I reached out to the support team multiple times via live chat and phone calls, but the issue remains unresolved. They claimed the shipment was sent in full. When I contacted the courier company, they confirmed that they delivered the shipment exactly as received from [SHEIN].

This has caused a lot of frustration, and I kindly ask the company to: investigate the issue thoroughly and identify the reason behind this significant shortage. I also request either:

The missing items to be resent to me.
A refund for the value of the missing items.
I look forward to your prompt response and resolution of this matter.",en,missing items poor customer support recently placed order order number gsh10529a000snm shein unfortunately experience disappointing shipment supposed contain 48 items received 34 items leaving 14 items missing reached support team multiple times via live chat phone calls issue remains unresolved claimed shipment sent full contacted courier company confirmed delivered shipment exactly received shein caused lot frustration kindly ask company investigate issue thoroughly identify reason behind significant shortage also request either missing items resent refund value missing items look forward prompt response resolution matter
I was scammed out of money,"I was scammed out of money with them guys. From one of their sellers. I gave an address(my address). It said delivered and signed for. Nothing was delivered to my house. I was home all day and my camera works. I was told to contact the shipping company(fedex) I did. I gave them the tracking number that was given to me. Their response was ""the tracking number does not match the address that was given to them"" I then screen shot the tracking, address all on the same receipt. I contacted Shein, took them a week just to tell me that there is nothing they can do because it says delivered. After they told me to do all that and file report. I even took it a step further to contact the seller directly. Never got a response. My opinion. Leave the chinese overseas company alone. Nothing america can do if you cheated out of money. Contacting shein does nothing. I have followed their process

P.S. you responding to this review in the publics eye, does not show your concern. It does not show that you care. I just want to put it out there to the world. I've done my part. Wish i was allowed screen shots to show our communication with your company","I was scammed out of money I was scammed out of money with them guys. From one of their sellers. I gave an address(my address). It said delivered and signed for. Nothing was delivered to my house. I was home all day and my camera works. I was told to contact the shipping company(fedex) I did. I gave them the tracking number that was given to me. Their response was ""the tracking number does not match the address that was given to them"" I then screen shot the tracking, address all on the same receipt. I contacted Shein, took them a week just to tell me that there is nothing they can do because it says delivered. After they told me to do all that and file report. I even took it a step further to contact the seller directly. Never got a response. My opinion. Leave the chinese overseas company alone. Nothing america can do if you cheated out of money. Contacting shein does nothing. I have followed their process

P.S. you responding to this review in the publics eye, does not show your concern. It does not show that you care. I just want to put it out there to the world. I've done my part. Wish i was allowed screen shots to show our communication with your company",en,scammed money scammed money guys one sellers gave addressmy address said delivered signed nothing delivered house home day camera works told contact shipping companyfedex gave tracking number given response tracking number match address given screen shot tracking address receipt contacted shein took week tell nothing says delivered told file report even took step contact seller directly never got response opinion leave chinese overseas company alone nothing america cheated money contacting shein nothing followed process ps responding review publics eye show concern show care want put world ive done part wish allowed screen shots show communication company
Shein marketplace vendor credit fraud,"I have been purchasing Shein clothing and home textiles for approximately a year. I appreciate it the styles and affordable pricing of the items I received.

I found the clothing to be of decent quality, and true to the images and descriptions on the website. Most of the items were true to size. The fabric was often a lightweight material and would only last a season or two. Home Textiles were usually cheaper materials and smaller than presented on the website.

My issue is that recently a purchase was made through a vendor who posted an item that was significantly lower price then other items of similar design. I purchased this item and it was given a tracking number that was fraudulent, as verified through my local post office. I notified Shein and customer service advised that I had to wait for the process. The vendor refunded the money, however to repurchase the item would been significantly more money.

In researching the vendor, I noted that all of the reviews on the now closed store had the same review,""item not received wrong tracking number"". It seems this vendor sold items at lower prices, put in fraudulent tracking number, and refunded the money once the complaint was made. Why would a vendor do this? To collect payment information and addresses for fraud or worse, to sell my information.

When I brought this to customer service attention, they commented that ""it's a pity"" and that they could not do anything since the money had been refunded. I had contacted them twice before the money had been refunded and they told me to wait.

I had also provided them with screenshots of all of the complaints, and the closed store that I had purchased my item from. They had no response regarding this shady vendor, nor any remedy. Just, you've been refunded (which was part of the scam).

I feel that Shein is complicit in allowing their customers data to be compromised by their Marketplace vendors.

I don't know if a remedy can be reached. But countering accusations of fraud with pad answers from customer service is an insult to your customers. Advocating for your vendors who may be stealing from your customers in your name is not good business.

Well I appreciate it the value that shine offered on its clothing and Home Textiles, I now have to monitor my credit card statements for fraud. I don't know if the trade off is worth it. I will not be doing business with this company going forward and I suggest others take this review into consideration before they do business with this company as well.","Shein marketplace vendor credit fraud I have been purchasing Shein clothing and home textiles for approximately a year. I appreciate it the styles and affordable pricing of the items I received.

I found the clothing to be of decent quality, and true to the images and descriptions on the website. Most of the items were true to size. The fabric was often a lightweight material and would only last a season or two. Home Textiles were usually cheaper materials and smaller than presented on the website.

My issue is that recently a purchase was made through a vendor who posted an item that was significantly lower price then other items of similar design. I purchased this item and it was given a tracking number that was fraudulent, as verified through my local post office. I notified Shein and customer service advised that I had to wait for the process. The vendor refunded the money, however to repurchase the item would been significantly more money.

In researching the vendor, I noted that all of the reviews on the now closed store had the same review,""item not received wrong tracking number"". It seems this vendor sold items at lower prices, put in fraudulent tracking number, and refunded the money once the complaint was made. Why would a vendor do this? To collect payment information and addresses for fraud or worse, to sell my information.

When I brought this to customer service attention, they commented that ""it's a pity"" and that they could not do anything since the money had been refunded. I had contacted them twice before the money had been refunded and they told me to wait.

I had also provided them with screenshots of all of the complaints, and the closed store that I had purchased my item from. They had no response regarding this shady vendor, nor any remedy. Just, you've been refunded (which was part of the scam).

I feel that Shein is complicit in allowing their customers data to be compromised by their Marketplace vendors.

I don't know if a remedy can be reached. But countering accusations of fraud with pad answers from customer service is an insult to your customers. Advocating for your vendors who may be stealing from your customers in your name is not good business.

Well I appreciate it the value that shine offered on its clothing and Home Textiles, I now have to monitor my credit card statements for fraud. I don't know if the trade off is worth it. I will not be doing business with this company going forward and I suggest others take this review into consideration before they do business with this company as well.",en,shein marketplace vendor credit fraud purchasing shein clothing home textiles approximately year appreciate styles affordable pricing items received found clothing decent quality true images descriptions website items true size fabric often lightweight material would last season two home textiles usually cheaper materials smaller presented website issue recently purchase made vendor posted item significantly lower price items similar design purchased item given tracking number fraudulent verified local post office notified shein customer service advised wait process vendor refunded money however repurchase item would significantly money researching vendor noted reviews closed store reviewitem received wrong tracking number seems vendor sold items lower prices put fraudulent tracking number refunded money complaint made would vendor collect payment information addresses fraud worse sell information brought customer service attention commented pity could anything since money refunded contacted twice money refunded told wait also provided screenshots complaints closed store purchased item response regarding shady vendor remedy youve refunded part scam feel shein complicit allowing customers data compromised marketplace vendors dont know remedy reached countering accusations fraud pad answers customer service insult customers advocating vendors may stealing customers name good business well appreciate value shine offered clothing home textiles monitor credit card statements fraud dont know trade worth business company going forward suggest others take review consideration business company well
The worst online shop I have ever…,"The worst online shop I have ever encountered. Items were not shipped, and support told me to wait. After 10 days, I contacted them again, and they told me the time had expired, so they can’t refund or resend the items.","The worst online shop I have ever… The worst online shop I have ever encountered. Items were not shipped, and support told me to wait. After 10 days, I contacted them again, and they told me the time had expired, so they can’t refund or resend the items.",en,worst online shop ever… worst online shop ever encountered items shipped support told wait 10 days contacted told time expired ’ refund resend items
SpeedyX is awful!!!,"I’ve been shopping with Shein for years!! But I have deactivated my account. Their delivery service SpeedyX is terrible!!

They leave packages in insecure places and shein refuses to do anything about it and won’t give me a refund. I will not be purchasing from them until they stop using speedyx or start valuing their customers more. Too many customers complaining about the same issue and they just ignore.","SpeedyX is awful!!! I’ve been shopping with Shein for years!! But I have deactivated my account. Their delivery service SpeedyX is terrible!!

They leave packages in insecure places and shein refuses to do anything about it and won’t give me a refund. I will not be purchasing from them until they stop using speedyx or start valuing their customers more. Too many customers complaining about the same issue and they just ignore.",en,speedyx awful ’ shopping shein years deactivated account delivery service speedyx terrible leave packages insecure places shein refuses anything ’ give refund purchasing stop using speedyx start valuing customers many customers complaining issue ignore
i got all the stuff u ordered but i…,i got all the stuff u ordered but i order three camera covers but i only got to in the order.,i got all the stuff u ordered but i… i got all the stuff u ordered but i order three camera covers but i only got to in the order.,en,got stuff ordered i… got stuff ordered order three camera covers got order
Shein customer service is absolutely…,"Shein customer service is absolutely garbage!! I didn't receive my parcel & asked for a refund numerous time, but never had any correspondence. I won't be ordering again. I suppose you get want you pay for!!!","Shein customer service is absolutely… Shein customer service is absolutely garbage!! I didn't receive my parcel & asked for a refund numerous time, but never had any correspondence. I won't be ordering again. I suppose you get want you pay for!!!",en,shein customer service absolutely… shein customer service absolutely garbage didnt receive parcel asked refund numerous time never correspondence wont ordering suppose get want pay
Absolutely the worst customer service…,"Absolutely the worst customer service I've given 2 not great reviews already all they say is contact customer service on the link below , the link doesn't work and I've tried endlessly to contact customer service, you can't, you don't get anywhere nothing gets solved 🙄 still waiting for a refund from boxing day 🤬 useless it definitely puts you off ordering anymore items .AGAIN they've sent the same robotic reply saying click on the link which doesn't work 😡😡😡😡 then you go onto the shein website nobody to get hold of you are literally going round in circles , 21 days still no refund disgusting customer service !!!!!!!","Absolutely the worst customer service… Absolutely the worst customer service I've given 2 not great reviews already all they say is contact customer service on the link below , the link doesn't work and I've tried endlessly to contact customer service, you can't, you don't get anywhere nothing gets solved 🙄 still waiting for a refund from boxing day 🤬 useless it definitely puts you off ordering anymore items .AGAIN they've sent the same robotic reply saying click on the link which doesn't work 😡😡😡😡 then you go onto the shein website nobody to get hold of you are literally going round in circles , 21 days still no refund disgusting customer service !!!!!!!",en,absolutely worst customer service… absolutely worst customer service ive given 2 great reviews already say contact customer service link link doesnt work ive tried endlessly contact customer service cant dont get anywhere nothing gets solved 🙄 still waiting refund boxing day 🤬 useless definitely puts ordering anymore items theyve sent robotic reply saying click link doesnt work 😡😡😡😡 go onto shein website nobody get hold literally going round circles 21 days still refund disgusting customer service
Good not inconvenient,Good not inconvenient,Good not inconvenient Good not inconvenient,en,good inconvenient good inconvenient
This organisation is entirely…,This organisation is entirely unethical. All who buy it’s wares are complicit in exploitation of the poor and vulnerable. Search for Shein on the BBC news website for more information.,This organisation is entirely… This organisation is entirely unethical. All who buy it’s wares are complicit in exploitation of the poor and vulnerable. Search for Shein on the BBC news website for more information.,en,organisation entirely… organisation entirely unethical buy ’ wares complicit exploitation poor vulnerable search shein bbc news website information
Are you ok Shein?,You still have NOT reimbursed me for the items that you did not deliver at all.,Are you ok Shein? You still have NOT reimbursed me for the items that you did not deliver at all.,en,ok shein still reimbursed items deliver
Plus size ladies on a budget? Shein is the place,"1. You added Shein Curve.
2.when I need an outfit, Shein gets my Business.
3. The quality of the products I have bought Is EXCELLENT.
4. No hanging threads, quality zippers.
5. Shein cares about the women they serve who are on a budget!","Plus size ladies on a budget? Shein is the place 1. You added Shein Curve.
2.when I need an outfit, Shein gets my Business.
3. The quality of the products I have bought Is EXCELLENT.
4. No hanging threads, quality zippers.
5. Shein cares about the women they serve who are on a budget!",en,plus size ladies budget shein place 1 added shein curve 2when need outfit shein gets business 3 quality products bought excellent 4 hanging threads quality zippers 5 shein cares women serve budget
I love all the merchandise.It is very…,I love all the merchandise.It is very affordable and it always comes on time.I order a whole lot from this company,I love all the merchandise.It is very… I love all the merchandise.It is very affordable and it always comes on time.I order a whole lot from this company,en,love merchandiseit very… love merchandiseit affordable always comes timei order whole lot company
RESEARCH BEFORE YOU BUY!!!!,"Oh my gosh, who is still shopping here?? Please do research people!! Shein is involved with so much sl@ve and ch1ld l@bour, as well as t0x1c forever ch3m1cals in their clothes, plus st3@ling loads of designs from 0th3r art1sts!! Please st0p buying from Shein!!","RESEARCH BEFORE YOU BUY!!!! Oh my gosh, who is still shopping here?? Please do research people!! Shein is involved with so much sl@ve and ch1ld l@bour, as well as t0x1c forever ch3m1cals in their clothes, plus st3@ling loads of designs from 0th3r art1sts!! Please st0p buying from Shein!!",en,research buy oh gosh still shopping please research people shein involved much slve ch1ld lbour well t0x1c forever ch3m1cals clothes plus st3ling loads designs 0th3r art1sts please st0p buying shein
Article manquant,Article manquant,Article manquant Article manquant,en,article manquant article manquant
Things were broken upon arrival,Things were broken upon arrival,Things were broken upon arrival Things were broken upon arrival,en,things broken upon arrival things broken upon arrival
I never got my order,I never got my order. Supposedly it wasn't a complete address when it was. I double checked. Very disappointed 😞,I never got my order I never got my order. Supposedly it wasn't a complete address when it was. I double checked. Very disappointed 😞,en,never got order never got order supposedly wasnt complete address double checked disappointed 😞
me reembolsaron super rápido,me reembolsaron super rápido,me reembolsaron super rápido me reembolsaron super rápido,en,reembolsaron super rápido reembolsaron super rápido
